{
  "schema": "csm-edge-inventory/1",
  "inventoryId": "consumer-edge-inventory",
  "revision": 1,
  "edges": [
    {
      "id": "csm-scan->csm-plan",
      "producer": "csm-scan",
      "consumer": "csm-plan",
      "classification": "existing-persisted",
      "caller": {
        "producerEntryPoint": "csm-scan/scripts/scan.mjs",
        "consumerEntryPoint": "csm-plan/lib/input-resolver.mjs"
      },
      "schema": { "producer": "csm-norms/1", "consumer": "csm-norms/1" },
      "owner": { "producer": "csm-scan", "consumer": "csm-plan" },
      "runIdentity": {
        "producerField": "provenance.producerRevision",
        "consumerField": "sourceRunId",
        "continuity": "source-lineage"
      },
      "digestFields": {
        "required": ["sourceDigest"],
        "optional": ["fileDigest", "payloadDigest", "descriptorDigest"]
      },
      "path": {
        "producer": ".agents/norms/<date>-<repo>-<run>-norms.json",
        "consumer": "registered JSON input",
        "artifact": "norms"
      },
      "terminalBehavior": "consumer rejects invalid or projection input before dispatch",
      "recoveryBehavior": "retain the last complete norms artifact and retry from its source lineage",
      "rollback": true
    },
    {
      "id": "csm-scan->csm-bdd-tdd",
      "producer": "csm-scan",
      "consumer": "csm-bdd-tdd",
      "classification": "existing-persisted",
      "caller": {
        "producerEntryPoint": "csm-scan/scripts/scan.mjs",
        "consumerEntryPoint": "csm-bdd-tdd/lib/package.mjs"
      },
      "schema": { "producer": "csm-norms/1", "consumer": "csm-norms/1" },
      "owner": { "producer": "csm-scan", "consumer": "csm-bdd-tdd" },
      "runIdentity": {
        "producerField": "provenance.producerRevision",
        "consumerField": "sourceRunId",
        "continuity": "source-lineage"
      },
      "digestFields": {
        "required": ["sourceDigest"],
        "optional": ["fileDigest", "payloadDigest", "descriptorDigest"]
      },
      "path": {
        "producer": ".agents/norms/<date>-<repo>-<run>-norms.json",
        "consumer": "registered JSON input",
        "artifact": "norms"
      },
      "terminalBehavior": "consumer rejects invalid or projection input before mutation",
      "recoveryBehavior": "preserve the prior package and resume only from a verified norms artifact",
      "rollback": true
    },
    {
      "id": "csm-scan->csm-build",
      "producer": "csm-scan",
      "consumer": "csm-build",
      "classification": "existing-persisted",
      "caller": {
        "producerEntryPoint": "csm-scan/scripts/scan.mjs",
        "consumerEntryPoint": "csm-build/lib/state.mjs"
      },
      "schema": { "producer": "csm-norms/1", "consumer": "csm-norms/1" },
      "owner": { "producer": "csm-scan", "consumer": "csm-build" },
      "runIdentity": {
        "producerField": "provenance.producerRevision",
        "consumerField": "sourceRunId",
        "continuity": "source-lineage"
      },
      "digestFields": {
        "required": ["sourceDigest"],
        "optional": ["fileDigest", "payloadDigest", "descriptorDigest"]
      },
      "path": {
        "producer": ".agents/norms/<date>-<repo>-<run>-norms.json",
        "consumer": "registered JSON input",
        "artifact": "norms"
      },
      "terminalBehavior": "build refuses untyped or invalid norms before execution",
      "recoveryBehavior": "resume from the last complete build checkpoint with the prior norms lineage",
      "rollback": true
    },
    {
      "id": "csm-scan->csm-review",
      "producer": "csm-scan",
      "consumer": "csm-review",
      "classification": "required-persisted-generic",
      "caller": {
        "producerEntryPoint": "csm-scan/scripts/scan.mjs",
        "consumerEntryPoint": "csm-review/lib/findings-validator.mjs"
      },
      "schema": { "producer": "csm-norms/1", "consumer": "csm-norms/1" },
      "owner": { "producer": "csm-scan", "consumer": "csm-review" },
      "runIdentity": {
        "producerField": "provenance.producerRevision",
        "consumerField": "sourceRunId",
        "continuity": "source-lineage"
      },
      "digestFields": {
        "required": ["sourceDigest"],
        "optional": ["fileDigest", "payloadDigest", "descriptorDigest"]
      },
      "path": {
        "producer": ".agents/norms/<date>-<repo>-<run>-norms.json",
        "consumer": ".agents/reviews/<date>-<repo>-<run>-review.json input",
        "artifact": "norms"
      },
      "terminalBehavior": "review rejects missing or untyped persisted norms before analysis",
      "recoveryBehavior": "leave the prior review report authoritative and retry with the same norms artifact",
      "rollback": true
    },
    {
      "id": "csm-plan->csm-bdd-tdd",
      "producer": "csm-plan",
      "consumer": "csm-bdd-tdd",
      "classification": "existing-persisted",
      "caller": {
        "producerEntryPoint": "csm-plan/lib/plan.mjs",
        "consumerEntryPoint": "csm-bdd-tdd/lib/package.mjs"
      },
      "schema": { "producer": "csm-plan/1", "consumer": "csm-plan/1" },
      "owner": { "producer": "csm-plan", "consumer": "csm-bdd-tdd" },
      "runIdentity": {
        "producerField": "control.runId",
        "consumerField": "sourceRunId",
        "continuity": "source-lineage"
      },
      "digestFields": {
        "required": ["sourceDigest"],
        "optional": ["fileDigest", "payloadDigest", "descriptorDigest"]
      },
      "path": {
        "producer": ".agents/plans/<date>-<goal>-<run>-csm.json",
        "consumer": "validated JSON plan input",
        "artifact": "plan"
      },
      "terminalBehavior": "mutation refuses a terminal or invalid plan",
      "recoveryBehavior": "resume the plan from its durable control state without replacing a terminal plan",
      "rollback": true
    },
    {
      "id": "csm-plan->csm-build",
      "producer": "csm-plan",
      "consumer": "csm-build",
      "classification": "existing-persisted",
      "caller": {
        "producerEntryPoint": "csm-plan/lib/plan.mjs",
        "consumerEntryPoint": "csm-build/lib/state.mjs"
      },
      "schema": { "producer": "csm-plan/1", "consumer": "csm-plan/1" },
      "owner": { "producer": "csm-plan", "consumer": "csm-build" },
      "runIdentity": {
        "producerField": "control.runId",
        "consumerField": "sourceRunId",
        "continuity": "source-lineage"
      },
      "digestFields": {
        "required": ["sourceDigest"],
        "optional": ["fileDigest", "payloadDigest", "descriptorDigest"]
      },
      "path": {
        "producer": ".agents/plans/<date>-<goal>-<run>-csm.json",
        "consumer": "validated JSON plan input",
        "artifact": "plan"
      },
      "terminalBehavior": "build refuses an invalid or incompatible plan before execution",
      "recoveryBehavior": "resume from the last complete build checkpoint and preserve the plan pointer",
      "rollback": true
    },
    {
      "id": "csm-ddd->csm-plan",
      "producer": "csm-ddd",
      "consumer": "csm-plan",
      "classification": "required-persisted-generic",
      "caller": {
        "producerEntryPoint": "csm-ddd/scripts/ddd.mjs",
        "consumerEntryPoint": "csm-plan/lib/input-resolver.mjs"
      },
      "schema": { "producer": "csm-ddd-report/1", "consumer": "csm-ddd-report/1" },
      "owner": { "producer": "csm-ddd", "consumer": "csm-plan" },
      "runIdentity": {
        "producerField": "runId",
        "consumerField": "sourceRunId",
        "continuity": "source-lineage"
      },
      "digestFields": {
        "required": ["sourceDigest"],
        "optional": ["fileDigest", "payloadDigest", "descriptorDigest"]
      },
      "path": {
        "producer": ".agents/ddd/<date>-<repo>-<run>-ddd-report.json + ddd-graph.json",
        "consumer": "explicit registered DDD pair input",
        "artifact": "ddd-pair"
      },
      "terminalBehavior": "plan rejects an unpaired, stale, or projection DDD input",
      "recoveryBehavior": "retain the prior plan and rerun against a matching report/graph pair",
      "rollback": true
    },
    {
      "id": "csm-ddd->csm-build",
      "producer": "csm-ddd",
      "consumer": "csm-build",
      "classification": "existing-persisted",
      "caller": {
        "producerEntryPoint": "csm-ddd/scripts/ddd.mjs",
        "consumerEntryPoint": "csm-build/lib/state.mjs"
      },
      "schema": { "producer": "csm-ddd-report/1", "consumer": "csm-ddd-report/1" },
      "owner": { "producer": "csm-ddd", "consumer": "csm-build" },
      "runIdentity": {
        "producerField": "runId",
        "consumerField": "sourceRunId",
        "continuity": "source-lineage"
      },
      "digestFields": {
        "required": ["sourceDigest"],
        "optional": ["fileDigest", "payloadDigest", "descriptorDigest"]
      },
      "path": {
        "producer": ".agents/ddd/<date>-<repo>-<run>-ddd-report.json + ddd-graph.json",
        "consumer": "explicit registered DDD pair input",
        "artifact": "ddd-pair"
      },
      "terminalBehavior": "build refuses an unpaired or stale DDD input before execution",
      "recoveryBehavior": "resume from the build checkpoint while retaining the matching DDD pair",
      "rollback": true
    },
    {
      "id": "csm-deep-research->csm-grill",
      "producer": "csm-deep-research",
      "consumer": "csm-grill",
      "classification": "required-persisted-generic",
      "caller": {
        "producerEntryPoint": "csm-deep-research/lib/research.mjs",
        "consumerEntryPoint": "csm-grill/lib/approach.mjs"
      },
      "schema": { "producer": "csm-research/1", "consumer": "csm-research/1" },
      "owner": { "producer": "csm-deep-research", "consumer": "csm-grill" },
      "runIdentity": {
        "producerField": "runId",
        "consumerField": "sourceRunId",
        "continuity": "source-lineage"
      },
      "digestFields": {
        "required": ["sourceDigest"],